{
  "$schema": "state.schema.json",
  "task_id": "filepilot-distribucion",
  "active_branch": "feat/filepilot-distribucion",
  "verified_commit": "98049fcab3582e5db82858966afb87e672aa5c52",
  "last_platform": "windows",
  "status": "IN_PROGRESS",
  "cycle": 0,
  "tests": {
    "linux": {"status": "PENDING", "command": "GitHub Actions: Release FilePilot", "summary": "Falta construir y probar el ejecutable Linux x86_64."},
    "windows": {"status": "PENDING", "command": "python tools/release.py; GitHub Actions: Release FilePilot", "summary": "Falta construir y probar el ejecutable Windows x64."},
    "macos": {"status": "NOT_APPLICABLE", "command": null, "summary": "FilePilot y sus artefactos nativos no incluyen macOS."},
    "ci": {"status": "PENDING", "command": "GitHub Actions: Pruebas multiplataforma y Release FilePilot", "summary": "Falta validar el workflow de release y el commit candidato."}
  },
  "next_action": "Completar T1 y continuar por las dependencias hasta validar los artefactos y la release.",
  "blocked_reason": null,
  "updated_at": "2026-09-01T10:03:52Z"
}
